{
  "schema_version": "v61_one_token_path.v1",
  "policy": {
    "ssd_resident_real_model_runtime_claim_ready": false,
    "real_model_execution_ready": false,
    "release_ready": false,
    "required_before_ssd_resident_runtime_claim": [
      "actual-mixtral-ssd-tensor-page-read",
      "actual-tensor-dtype-quant-dequant",
      "torch-matvec-parity",
      "real-expert-ffn-forward-parity",
      "real-moe-block-forward-parity",
      "one-token-logits-parity"
    ],
    "required_before_ssd_resident_runtime_claim_count": 6,
    "passed_before_ssd_resident_runtime_claim_count": 3,
    "blocked_before_ssd_resident_runtime_claim_count": 3,
    "required_artifact_count": 10,
    "present_required_artifact_count": 5,
    "missing_required_artifact_count": 5,
    "missing_required_artifact_ids": [
      "moe-block-forward-parity-rows",
      "one-token-logits-parity-rows",
      "sixteen-token-decode-rows",
      "cold-warm-cache-measurement-rows",
      "ssd-bytes-miss-tps-rows"
    ],
    "blocked_before_ssd_resident_runtime_claim": [
      "real-expert-ffn-forward-parity",
      "real-moe-block-forward-parity",
      "one-token-logits-parity"
    ]
  },
  "milestones": [
    {
      "order": 1,
      "milestone_id": "actual-mixtral-ssd-tensor-page-read",
      "required_evidence": "actual Mixtral hotset tensor page is bound to remote/direct-IO replay and sampled without committing checkpoint payloads",
      "current_status": "pass",
      "evidence_path": "results/v61aa_hotset_tensor_slice_verifier_summary.csv",
      "claim_boundary": "bounded tensor-page read evidence only; not model forward execution",
      "summary_checks": [
        {"summary_id": "v61aa", "field": "v61aa_hotset_tensor_slice_verifier_ready", "expected": "1"},
        {"summary_id": "v61aa", "field": "v61z_hotset_direct_io_replay_ready", "expected": "1"},
        {"summary_id": "v61aa", "field": "v61v_remote_page_tensor_binding_ready", "expected": "1"},
        {"summary_id": "v61aa", "field": "checkpoint_payload_bytes_committed_to_repo", "expected": "0"}
      ]
    },
    {
      "order": 2,
      "milestone_id": "actual-tensor-dtype-quant-dequant",
      "required_evidence": "sampled BF16 tensor values are finite and q8/q4 tile quant probes are replayable",
      "current_status": "pass",
      "evidence_path": "results/v61aa_hotset_tensor_slice_verifier_summary.csv;results/v61ab_hotset_tensor_tile_quant_probe_summary.csv",
      "claim_boundary": "bounded dtype/quant probe evidence only; not expert or block forward parity",
      "summary_checks": [
        {"summary_id": "v61aa", "field": "bf16_tensor_slice_stats_ready", "expected": "1"},
        {"summary_id": "v61aa", "field": "sampled_bf16_nan_rows", "expected": "0"},
        {"summary_id": "v61aa", "field": "sampled_bf16_inf_rows", "expected": "0"},
        {"summary_id": "v61ab", "field": "q8_quant_probe_ready", "expected": "1"},
        {"summary_id": "v61ab", "field": "q4_quant_probe_ready", "expected": "1"}
      ]
    },
    {
      "order": 3,
      "milestone_id": "torch-matvec-parity",
      "required_evidence": "hotset BF16 tile matvec rows match PyTorch CPU reference",
      "current_status": "pass",
      "evidence_path": "results/v61ab_hotset_tensor_tile_quant_probe_summary.csv",
      "claim_boundary": "tile matvec parity only; not expert FFN real execution",
      "summary_checks": [
        {"summary_id": "v61ab", "field": "torch_matvec_parity_ready", "expected": "1"},
        {"summary_id": "v61ab", "field": "torch_matvec_parity_rows", "expected": "128"},
        {"summary_id": "v61ab", "field": "torch_matvec_parity_pass_rows", "expected": "128"}
      ]
    },
    {
      "order": 4,
      "milestone_id": "real-expert-ffn-forward-parity",
      "required_evidence": "one real Mixtral expert FFN forward matches PyTorch reference with real-model evidence flag",
      "current_status": "blocked",
      "evidence_path": "results/v61ab_hotset_tensor_tile_quant_probe_summary.csv",
      "claim_boundary": "contract exists, but current summary has real execution disabled",
      "summary_checks": [
        {"summary_id": "v61ab", "field": "expert_ffn_parity_contract_ready", "expected": "1"},
        {"summary_id": "v61ab", "field": "expert_ffn_parity_real_model_execution_ready", "expected": "0"}
      ],
      "blocked_by": ["expert_ffn_parity_real_model_execution_ready=0"]
    },
    {
      "order": 5,
      "milestone_id": "real-moe-block-forward-parity",
      "required_evidence": "one real Mixtral MoE block forward matches PyTorch reference",
      "current_status": "blocked",
      "evidence_path": "not-produced",
      "claim_boundary": "no real MoE block forward parity artifact is present",
      "blocked_by": ["real expert FFN forward parity is still blocked", "MoE block parity rows are missing"]
    },
    {
      "order": 6,
      "milestone_id": "one-token-logits-parity",
      "required_evidence": "one-token logits match a PyTorch reference for the same checkpoint, tokenizer input, and routing path",
      "current_status": "blocked",
      "evidence_path": "not-produced",
      "claim_boundary": "no one-token logits parity artifact is present",
      "blocked_by": ["real MoE block forward parity is still blocked", "logits parity rows are missing"]
    },
    {
      "order": 7,
      "milestone_id": "sixteen-token-decode",
      "required_evidence": "16-token decode from the SSD-resident runtime is replayable and compared to reference output",
      "current_status": "blocked",
      "evidence_path": "not-produced",
      "claim_boundary": "decode is blocked until one-token logits parity is accepted",
      "blocked_by": ["one-token logits parity is still blocked"]
    },
    {
      "order": 8,
      "milestone_id": "cold-warm-cache-measurement",
      "required_evidence": "cold-cache and warm-cache runs are measured separately with pinned runtime settings",
      "current_status": "blocked",
      "evidence_path": "not-produced",
      "claim_boundary": "cache performance claims are blocked until decode exists",
      "blocked_by": ["16-token decode is still blocked"]
    },
    {
      "order": 9,
      "milestone_id": "ssd-bytes-miss-tps-recording",
      "required_evidence": "SSD bytes/token, miss/token, and TPS are recorded for cold and warm runs",
      "current_status": "blocked",
      "evidence_path": "not-produced",
      "claim_boundary": "runtime metric claims are blocked until cold/warm decode measurement exists",
      "blocked_by": ["cold/warm cache measurement is still blocked"]
    }
  ],
  "required_artifacts": [
    {
      "artifact_id": "mixtral-ssd-tensor-page-read-rows",
      "artifact_kind": "csv",
      "path": "results/v61aa_hotset_tensor_slice_verifier/verify_001/source_v61v/remote_sample_tensor_binding_rows.csv",
      "linked_milestone_id": "actual-mixtral-ssd-tensor-page-read",
      "required_for_runtime_claim": true,
      "min_rows": 16,
      "pass_field": "remote_hash_bound",
      "required_columns": [
        "binding_id",
        "remote_sample_id",
        "source_page_id",
        "remote_page_sha256",
        "model_id",
        "shard_name",
        "shard_page_index",
        "tensor_name",
        "tensor_role",
        "layer_index",
        "expert_index",
        "dtype",
        "tensor_segment_bytes",
        "page_offset_start",
        "page_offset_end",
        "tensor_offset_start_in_tensor",
        "tensor_offset_end_in_tensor",
        "moe_expert_page",
        "embedding_page",
        "remote_hash_bound",
        "checkpoint_payload_bytes_persisted",
        "checkpoint_payload_bytes_committed_to_repo",
        "route_jump_rows"
      ]
    },
    {
      "artifact_id": "tensor-dtype-stat-rows",
      "artifact_kind": "csv",
      "path": "results/v61aa_hotset_tensor_slice_verifier/verify_001/hotset_tensor_slice_stat_rows.csv",
      "linked_milestone_id": "actual-tensor-dtype-quant-dequant",
      "required_for_runtime_claim": true,
      "min_rows": 16,
      "pass_field": "bf16_tensor_slice_stats_ready",
      "required_columns": [
        "tensor_slice_id",
        "binding_id",
        "remote_sample_id",
        "model_id",
        "shard_name",
        "shard_page_index",
        "tensor_name",
        "tensor_role",
        "layer_index",
        "expert_index",
        "dtype",
        "local_page_path",
        "page_offset_start",
        "page_offset_end",
        "tensor_segment_bytes",
        "tensor_segment_elements",
        "tensor_segment_sha256",
        "local_page_sha256",
        "remote_page_sha256",
        "segment_hash_bound_to_remote_page",
        "direct_read_hash_match",
        "sampled_bf16_values",
        "sampled_finite_values",
        "sampled_nan_values",
        "sampled_inf_values",
        "sampled_zero_values",
        "sampled_nonzero_values",
        "sampled_min_fp32",
        "sampled_max_fp32",
        "sampled_mean_fp32",
        "sampled_mean_abs_fp32",
        "sampled_rms_fp32",
        "first_sample_bf16_hex",
        "last_sample_bf16_hex",
        "moe_expert_page",
        "embedding_page",
        "bf16_tensor_slice_stats_ready",
        "checkpoint_payload_bytes_committed_to_repo",
        "actual_model_generation_ready",
        "route_jump_rows"
      ]
    },
    {
      "artifact_id": "tensor-quant-dequant-metric-rows",
      "artifact_kind": "csv",
      "path": "results/v61ab_hotset_tensor_tile_quant_probe/probe_001/hotset_tensor_tile_quant_metric_rows.csv",
      "linked_milestone_id": "actual-tensor-dtype-quant-dequant",
      "required_for_runtime_claim": true,
      "min_rows": 1,
      "pass_field": "hotset_numeric_tile_probe_ready",
      "required_columns": [
        "metric_id",
        "tensor_tile_probe_rows",
        "moe_tensor_tile_probe_rows",
        "embedding_tensor_tile_probe_rows",
        "tile_bf16_value_rows",
        "tile_sample_trace_rows",
        "finite_baseline_dot_rows",
        "finite_q8_dot_rows",